student,email,subjects,overall_percentage,time,status
Aarya Mayekar Emailid: aaryamayekar971@gmail.com,aaryamayekar971@gmail.com,2,71.34,2026-02-10 14:21:20,Sent
Amit Patil Email id : sailatke333@gmail.com,sailatke333@gmail.com,2,46.52,2026-02-10 14:21:25,Sent
Nitesh Mulam Email id: niteshmulam30@gmail.com,niteshmulam30@gmail.com,2,51.575,2026-02-10 14:21:30,Sent
Sai Latke Emailid: sailatke2004@gmail.com,sailatke2004@gmail.com,2,54.1,2026-02-10 14:21:34,Sent
Siddhi Mahajan Email id: siddhiavinashmahajan@gmail.com,siddhiavinashmahajan@gmail.com,2,52.565,2026-02-10 14:21:38,Sent
